{
  "$schema": "https://raw.githubusercontent.com/omar-hanafy/glyphpact/main/schema/icon-font-config.schema.json",
  "input": "icons",
  "output": "generated/app_icons",
  "fontFamily": "AppIcons",
  "className": "AppIcons",
  "catalog": true,
  "fontPackage": null,
  "startCodepoint": "0xE000",
  "unitsPerEm": 1000,
  "padding": 0,
  "clipToViewBox": true,
  "policy": {
    "lossy": "error",
    "unrepresentable": "error"
  },
  "jobs": 0,
  "icons": {
    "arrows/back.svg": {
      "name": "back",
      "matchTextDirection": true,
      "author": "GlyphPact contributors",
      "license": "MIT",
      "sourceUrl": "https://github.com/omar-hanafy/glyphpact/tree/main/examples/icons"
    },
    "status/verified.svg": {
      "name": "verified",
      "author": "GlyphPact contributors",
      "license": "MIT",
      "sourceUrl": "https://github.com/omar-hanafy/glyphpact/tree/main/examples/icons"
    }
  }
}
